427,5332493,KERN CO.,LAKE ISABELLA,8/1/2003,0,Wildfire, , ,0,0,0,0,CA,PST, ,1161722,C,29,HNX,0,0,PARK/FOREST SERVICE, , , ,13,SW,13,SW,LAKE ISABELLA, , , , ,The China Fire started in July and was contained late in the day on August 4th...see July Stormdata.,,428,,,,,,,,,,,,,,,,,,,
428,5332501,TULARE CO.,CAMP NELSON,8/1/2003,0,Wildfire, , ,0,0,0,0,CA,PST, ,1161726,C,107,HNX,0,0,PARK/FOREST SERVICE, , , ,15,NE,15,NE,CAMP NELSON, , , , ,"The Cooney Fire was ignited by lightning late in the afternoon of the 31st of July and eventually managed as a resource burn.  Designated a resource burn by August 27th, it was reported to have burned 1928 acres.  There were no injuries with this fire and costs were unknown. The Cooney Fire was one of 17 fires started by lightning between July 28th and August 1st in the Sequoia National Forest and Sequoia-Kings Canyon National Parks.",,429,,,,,,,,,,,,,,,,,,,
429,5372410,MARIPOSA CO.,YOSEMITE VLG,8/1/2003,0,Wildfire, , ,0,0,0,0,CA,PST, ,1162964,C,43,HNX,0,0,PARK/FOREST SERVICE, , , ,2,N,2,N,YOSEMITE VLG, , , , ,The Duncan Complex continued to burn through the month as a resource burn within Yosemite National Park.,,430,,,,,,,,,,,,,,,,,,,
430,5369446,SAN DIEGO CO.,LAKE HENSHAW,8/4/2003,1257,Wildfire, , ,0,0,0,0,CA,PST, ,1160177,C,73,SGX,0,0,LAW ENFORCEMENT, , , ,3,S,1,S,LAKE HENSHAW, , , , ,,A brush fire closed Highway 79 between School House Road and Morettis.,431,,,,,,,,,,,,,,,,,,,
431,5369444,SAN DIEGO CO.,(MYF)MNTGMRY FLD SAN,8/10/2003,1530,Wildfire, , ,0,0,0,0,CA,PST, ,1160175,C,73,SGX,0,0,NEWSPAPER, , , ,3,E,4,E,(MYF)MNTGMRY FLD SAN, , , , ,,"After three days with temperatures near 100 degrees, a brush fire broke out and burned 25 acres before it was brought under control.",432,,,,,,,,,,,,,,,,,,,
432,5369448,SAN BERNARDINO CO.,CHINO,8/14/2003,2100,Wildfire, , ,0,0,0,0,CA,PST, ,1160179,C,71,SGX,0,0,NEWSPAPER, , , , , , , ,CHINO, , , , ,,A brush fire burned 22 acres before being fully controlled. About a dozen houses were threatened but no property was damaged.,433,,,,,,,,,,,,,,,,,,,
433,5369450,SAN BERNARDINO CO.,YUCAIPA,8/15/2003,1050,Wildfire, , ,0,0,0,0,CA,PST, ,1160181,C,71,SGX,0,0,NEWSPAPER, , , ,4,E,7,E,YUCAIPA, , , , ,,"Named the Wildwood Canyon Fire, this wildfire burned 200 acres of state park and national forest land before being fully contained. No property was damaged.",434,,,,,,,,,,,,,,,,,,,
434,5369449,RIVERSIDE CO.,BANNING,8/17/2003,1418,Wildfire, , ,0,0,0,0,CA,PST, ,1160180,C,65,SGX,0,0,NEWSPAPER, , , , , , , ,BANNING, , , , ,,A brush fire burned five acres before being fully controlled.,435,,,,,,,,,,,,,,,,,,,
435,5369451,RIVERSIDE CO.,MORENO VALLEY,8/18/2003,1250,Wildfire, , ,0,3,1000000,250000,CA,PST, ,1160182,C,65,SGX,0,0,NEWSPAPER, , , ,2,N,5,N,MORENO VALLEY, , , , ,,"Named the Locust Fire, this wildfire consumed 1889 acres between north Moreno Valley and Redlands before being fully contained. Several homes were threatened and evacuations were ordered. A hiker suffered burns, when he jumped through the fire front. Two fire fighters were injured, one from minor burns, the other from smoke inhalation. Property damage was confined to a mobile home, a moving van, a dozen cars, several out-buildings, power lines, and an orchard of citrus trees. Smoke and ash from the fire was observed as far north as Lake Arrowhead. The cost of fighting the fire was estimated at $1.1 million.",436,,,,,,,,,,,,,,,,,,,
436,5369452,RIVERSIDE CO.,MORENO VALLEY,8/18/2003,1300,Wildfire, , ,0,0,0,0,CA,PST, ,1160183,C,65,SGX,0,0,NEWSPAPER, , , , , , , ,MORENO VALLEY, , , , ,,"Named the Nason fire, it burned 35 acres along a hillside before being fully controlled.",437,,,,,,,,,,,,,,,,,,,
437,5369453,SAN BERNARDINO CO.,CAJON,8/20/2003,1545,Wildfire, , ,0,0,20000,0,CA,PST, ,1160184,C,71,SGX,0,0,NEWSPAPER, , , , , , , ,CAJON, , , , ,,"Named the Mormon Rocks Fire, it  burned 10 acres and caused Highway 138 to be closed for about one hour. Property damage was confined to a power line.",438,,,,,,,,,,,,,,,,,,,
438,5333796,TULARE CO.,MINERAL KING,8/21/2003,1300,Wildfire, , ,0,0,2000,0,CA,PST, ,1161731,C,107,HNX,0,0,PARK/FOREST SERVICE, , , ,10,ESE,10,ESE,MINERAL KING, , , , ,,The West Kern Fire was lightning-ignited during the afternoon of the 21st. It reached a size of 120 acres by the end of the month but it was managed as a resource burn. There were no injuries as the result of this fire.,439,,,,,,,,,,,,,,,,,,,
439,5369454,SAN DIEGO CO.,RAMONA,8/23/2003,1140,Wildfire, , ,0,0,0,0,CA,PST, ,1160185,C,73,SGX,0,0,NEWSPAPER, , , ,3,W,2,SW,RAMONA, , , , ,,This brush fire consumed 35 acres before being fully controlled.,440,,,,,,,,,,,,,,,,,,,
440,5369457,RIVERSIDE CO.,PERRIS,8/23/2003,1252,Wildfire, , ,0,0,0,0,CA,PST, ,1160188,C,65,SGX,0,0,NEWSPAPER, , , ,6,W,5,W,PERRIS, , , , ,,"Named the Lake Mathews fire, it burned 200 acres before being fully contained. About 100 homes were threatened, but no property was damaged.",441,,,,,,,,,,,,,,,,,,,
441,5369455,SAN BERNARDINO CO.,DEVORE,8/23/2003,1338,Wildfire, , ,0,0,0,0,CA,PST, ,1160186,C,71,SGX,0,0,NEWSPAPER, , , , , ,2,N,DEVORE, , , , ,,"This brush fire began near Glen Helen Parkway and spread north under the influence of 8-12 mph winds, however relative humidities were between 30-45 percent which helped slow the growth. total acres consumed were 40  before it was brought under control.",442,,,,,,,,,,,,,,,,,,,
442,5375225,SANTA CLARA CO.,CENTRAL PORTION,8/25/2003,2200,Wildfire, , ,0,4,0,0,CA,PST, ,1161479,C,85,MTR,0,0,BROADCAST MEDIA, , , , , , , ,CENTRAL PORTION, , , , ,,"Lightning started a wildfire in the Mt. Diablo Range between Gilroy and Brentwood that raged through the end of the month and into September. Four injuries were reported and a total of 30,180 acres were burned. One outbuilding was destroyed.",443,,,,,,,,,,,,,,,,,,,
443,5333038,MARIPOSA CO.,CATHEYS VLY,8/26/2003,700,Wildfire, , ,0,0,0,0,CA,PST, ,1161732,C,43,HNX,0,0,FIRE DEPT/RESCUE SQUAD, , , , , , , ,CATHEYS VLY, , , , ,The Mariposa Lightning Series of fires were battled by the California Department of Forestry and Fire Protection starting on the 26th and contained by the afternoon of the 27th.  There were three notable locations in this series: a fire of 77 acres was located in Catheys Valley; another of 640 acres at the Mariposa-Madera County line 13 miles SSW of Catheys Valley; and yet another of 100 acres at Road 200 and Fine Gold Creek Bridge.  The cost to fight this series of fires was not reported but no fatalities occurred as the result.,,444,,,,,,,,,,,,,,,,,,,
444,5369515,SAN DIEGO CO.,POWAY,8/27/2003,1430,Wildfire, , ,0,0,0,0,CA,PST, ,1160189,C,73,SGX,0,0,NEWSPAPER, , , , , , , ,POWAY, , , , ,,"A brush fire burned 55 acres  before being fully contained. A Day Care center was evacuated, several streets were closed, and an Industrial Park was threatened. However no property was damaged.",445,,,,,,,,,,,,,,,,,,,
445,5369517,SAN BERNARDINO CO.,PHELAN,8/28/2003,1425,Wildfire, , ,0,0,0,0,CA,PST, ,1160191,C,71,SGX,0,0,NEWSPAPER, , , ,4,S,4,S,PHELAN, , , , ,,"A brush fire consumed 7 acres in the area adjacent to the Oak Ridge Estates. No homes or structures were lost and no one was injured. Lightning caused phone and power outages in the Big Bear Lake area earlier this day, and may have been the cause of this fire.",446,,,,,,,,,,,,,,,,,,,
446,5372406,TULARE CO.,WILSONIA,9/1/2003,0,Wildfire, , ,0,0,0,0,CA,PST, ,1162960,C,107,HNX,0,0,PARK/FOREST SERVICE, , , ,14,E,14,E,WILSONIA, , , , ,"The Kaweah-Kern Complex of fires were essentially started July 28th and allowed to continue to burn as resource fires through the month of September. Fires within this complex included Williams, West Kern, Giant, Slide Bluffs, Bubbs, West Clover, High Bridge, East Fork, West Timber, Tar Gap 1, Tar Gap 2, Fry Pan, Soda Springs, and Paradise 2. Acreage burned: 5790 acres in Sequoia-Kings Canyon National Park; 2245 acres in the Sequoia National Forest; and, 435 acres in the Inyo National Forest. As of September 30th, the cost was $530.2K.",,447,,,,,,,,,,,,,,,,,,,
447,5337826,MARIPOSA CO.,YOSEMITE VLG,9/1/2003,0,Wildfire, , ,0,0,0,0,CA,PST, ,1162959,C,43,HNX,0,0,PARK/FOREST SERVICE, , , ,25,N,25,N,YOSEMITE VLG, , , , ,"The Kibbee Complex fire, having started July 20th by lightning, burned through the month of September as a resource burn. By the end of the month it had reached 9,230 acres and had an accumulated cost of $2M.",,448,,,,,,,,,,,,,,,,,,,
448,5372409,MARIPOSA CO.,YOSEMITE VLG,9/1/2003,0,Wildfire, , ,0,0,0,0,CA,PST, ,1162963,C,43,HNX,0,0,PARK/FOREST SERVICE, , , ,2,N,2,N,YOSEMITE VLG, , , , ,"The Duncan Complex Fire was ignited by lightning in July, and allowed to continue to burn through September as a resource burn. By the end of September it had consumed 1284 acres at an accumulated cost of $100K.",,449,,,,,,,,,,,,,,,,,,,
449,5337474,RIVERSIDE CO.,MORENO VALLEY,9/2/2003,1030,Wildfire, , ,0,0,0,0,CA,PST, ,1162351,C,65,SGX,0,0,NEWSPAPER, , , ,3,N,3,N,MORENO VALLEY, , , , ,,A brush fire burned 10 acres in the northern edge of Moreno Valley before being fully contained. Several residences were threatened but no property damage or injuries occurred.,450,,,,,,,,,,,,,,,,,,,
450,5372408,MADERA CO.,MAMMOTH MOUNTAIN,9/3/2003,0,Wildfire, , ,0,0,64000,0,CA,PST, ,1162962,C,39,HNX,0,0,PARK/FOREST SERVICE, , , ,8,SW,8,SW,MAMMOTH MOUNTAIN, , , , ,The Cargyle Complex Fire was ignited by lightning on the 3rd and allowed to burn through the month for resource benefits. By the end of the month it had burned 717 acres at a cost of $64K.,,451,,,,,,,,,,,,,,,,,,,
451,5336863,HUMBOLDT CO.,WEOTT,9/3/2003,700,Wildfire,22000, ,0,0,0,0,CA,PST, ,1162830,C,23,EKA,0,0,PARK/FOREST SERVICE, , , ,3,SW,3,SW,WEOTT, , , , ,Honeydew/Canoe Complex,"Lightning sparked numerous fire across Humboldt, Trinity, and Mendocino Counties.  The fires grew rapidly in the dry, windy conditions.  Over 50 total fires were ignited.  By September 30, approximately 26,000 acres were burned.  The largest fire was the Honeydew/Canoe Complex near Weott with 22,000 acres burned at the end of the month.  The Loma Fire burned 3740 acres and was contained on September 22.  The Covelo Complex near Covelo burned 240 acres and was contained on September 12.  At the end of September, only the Honeydew/Canoe Complex was not yet fully contained.",452,,,,,,,,,,,,,,,,,,,
452,5336865,TRINITY CO.,DEL LOMA,9/3/2003,700,Wildfire,3740, ,0,0,0,0,CA,PST, ,1162830,C,105,EKA,0,0,PARK/FOREST SERVICE, , , ,4,E,4,E,DEL LOMA, , , , ,Loma Fire,"Lightning sparked numerous fire across Humboldt, Trinity, and Mendocino Counties.  The fires grew rapidly in the dry, windy conditions.  Over 50 total fires were ignited.  By September 30, approximately 26,000 acres were burned.  The largest fire was the Honeydew/Canoe Complex near Weott with 22,000 acres burned at the end of the month.  The Loma Fire burned 3740 acres and was contained on September 22.  The Covelo Complex near Covelo burned 240 acres and was contained on September 12.  At the end of September, only the Honeydew/Canoe Complex was not yet fully contained.",453,,,,,,,,,,,,,,,,,,,
453,5336864,MENDOCINO CO.,COVELO,9/3/2003,700,Wildfire,240, ,0,0,0,0,CA,PST, ,1162830,C,45,EKA,0,0,PARK/FOREST SERVICE, , , ,10,NE,10,NE,COVELO, , , , ,Covelo Complex,"Lightning sparked numerous fire across Humboldt, Trinity, and Mendocino Counties.  The fires grew rapidly in the dry, windy conditions.  Over 50 total fires were ignited.  By September 30, approximately 26,000 acres were burned.  The largest fire was the Honeydew/Canoe Complex near Weott with 22,000 acres burned at the end of the month.  The Loma Fire burned 3740 acres and was contained on September 22.  The Covelo Complex near Covelo burned 240 acres and was contained on September 12.  At the end of September, only the Honeydew/Canoe Complex was not yet fully contained.",454,,,,,,,,,,,,,,,,,,,
454,5337473,RIVERSIDE CO.,(RAL)RIVERSIDE MUNI,9/3/2003,1106,Wildfire, , ,0,0,50000,0,CA,PST, ,1162350,C,65,SGX,0,0,NEWSPAPER, , , ,3,E,3,E,(RAL)RIVERSIDE MUNI, , , , ,,A brush fire burned power lines and self-storage units along Highway 91just north of Central Avenue.,455,,,,,,,,,,,,,,,,,,,
455,5337472,SAN DIEGO CO.,CAMP PENDLETON,9/3/2003,1400,Wildfire, , ,0,0,0,0,CA,PST, ,1162349,C,73,SGX,0,0,NEWSPAPER, , , , , , , ,CAMP PENDLETON, , , , ,,A brush fire burned 40 acres at Camp Pendleton. No structures were threatened and no injuries were reported.,456,,,,,,,,,,,,,,,,,,,
456,5372412,TULARE CO.,PORTERVILLE,9/3/2003,1700,Wildfire, , ,0,0,0,0,CA,PST, ,1162966,C,107,HNX,0,0,PARK/FOREST SERVICE, , , ,45,E,45,E,PORTERVILLE, , , , ,The Albanita/Hooker Fire in Sequoia National Forest was lightning ignited on the 3rd. It burned 175 acres by the 30th as it was allowed to burn for resource benefits. No injuries were reported nor was any structure lost.,,457,,,,,,,,,,,,,,,,,,,
457,5372407,TULARE CO.,VISALIA,9/5/2003,1200,Wildfire, , ,0,0,824000,0,CA,PST, ,1162961,C,107,HNX,0,0,PARK/FOREST SERVICE, , , ,40,E,40,E,VISALIA, , , , ,"Homers Nose 2 Fire in the Sequoia-Kings Canyon Park was lightning ignited on the 5th and allowed to burn throughout the month.  As of the 30th, it had consumed 230 acres at a cost of $824K with no fatalities or injuries nor structures lost.",,458,,,,,,,,,,,,,,,,,,,
458,5337471,SAN BERNARDINO CO.,HIGHLAND,9/5/2003,1404,Wildfire, , ,0,9,200000,0,CA,PST, ,1162348,C,71,SGX,0,0,NEWSPAPER, , , ,5,NE,2,SE,LAKE ARROWHEAD, , , , ,,"Named the Bridge fire, it burned 1352 acres before being fully contained. It forced the evacuation of the towns of Fredalba, Smiley Park, Nob Hill, Enchanted Forest, and part of Running Springs, affecting more than 1000 residents. The main highways, 330 and 18, were closed for several days. Property damage was contained to guardrails, power lines, and traffic signs along the highway corridors, in addition to one out building. Cost of fighting the fire were in excess of $2.3 million dollars.",459,,,,,,,,,,,,,,,,,,,
459,5374877,SISKIYOU CO.,COUNTYWIDE,9/12/2003,632,Wildfire, , ,0,0,0,0,CA,PST, ,1162215,C,93,MFR,0,0,OFFICIAL NWS OBS., , , , , , , ,COUNTYWIDE, , , , ,See below.,"A Red Flag Warning was issued effective at the above times for fire weather zones 280, which includes western Siskiyou county.
Strong offshore winds were expected.  The strong winds occurred on the first night...but relative humidity recoveries were high enough not to verify the warning in most areas.  The second night the winds abated but the recoveries were poor.

The Slater Butte RAWS and the Collins Baldy RAWS verified the warning on both nights. This was a strong offshore event and a critical fire weather pattern, so the warning was justified as far as the fire weather agencies were concerned.",460,,,,,,,,,,,,,,,,,,,
460,5337470,SAN BERNARDINO CO.,LOMA LINDA,9/12/2003,1500,Wildfire, , ,0,0,0,0,CA,PST, ,1162347,C,71,SGX,0,0,NEWSPAPER, , , ,2,SW,2,S,LOMA LINDA, , , , ,,A brush fire consumed 175 acres before being controlled. No homes or structures were endangered and no injuries were reported.,461,,,,,,,,,,,,,,,,,,,
461,5372411,TULARE CO.,PORTERVILLE,9/15/2003,1121,Wildfire, , ,0,0,460560,0,CA,PST, ,1162965,C,107,HNX,0,0,OTHER FEDERAL AGENCY, , , ,60,ESE,60,ESE,PORTERVILLE, , , , ,The Michael Fire had an unknown ignition near Chimney Peak in southeast Tulare County. It consumed 388 acres at a cost of $460K. No fatalities occurred nor were structures lost.,,462,,,,,,,,,,,,,,,,,,,
462,5337469,SAN BERNARDINO CO.,HESPERIA,9/17/2003,1240,Wildfire, , ,0,0,0,0,CA,PST, ,1162346,C,71,SGX,0,0,NEWSPAPER, , , ,6,S,6,S,HESPERIA, , , , ,,A brush fire consumed 40 acres and briefly threatened several homes in the Oak Hills subdivision of Hesperia. Lack of winds helped firefighters contain the blaze in a short period of time.,463,,,,,,,,,,,,,,,,,,,
463,5375291,SISKIYOU CO.,COUNTYWIDE,9/21/2003,635,Wildfire, , ,0,0,0,0,CA,PST, ,1162223,C,93,MFR,0,0,OFFICIAL NWS OBS., , , , , , , ,COUNTYWIDE, , , , ,See below.,"A Red Flag Warning was issued effective at the above times for Fire Weather zone 280, which covers Western Siskiyou county.  This warning verified at several RAWS stations in the area, including Slater Butte, Blue Ridge, and Collins Baldy.",464,,,,,,,,,,,,,,,,,,,
464,5337881,RIVERSIDE CO.,BEAUMONT,9/23/2003,928,Wildfire, , ,0,0,0,0,CA,PST, ,1162370,C,65,SGX,0,0,NEWSPAPER, , , ,1,NW,2,W,BEAUMONT, , , , ,,"A brush fire, combined with east winds gusting bear 30 mph, burned 110 acres in a dry wash. Homes were threatened along Elm Avenue near Oak Valley Parkway and in Three Rings Ranch Project.",465,,,,,,,,,,,,,,,,,,,
465,5336816,TULARE CO.,PORTERVILLE,10/1/2003,0,Wildfire, , ,0,0,150000,0,CA,PST, ,1162998,C,107,HNX,0,0,PARK/FOREST SERVICE, , , ,45,E,45,E,PORTERVILLE, , , , ,"The Albanita/Hooker Fire in the Sequoia National Forest was lightning ignited on September 3rd and then allowed to burn for resource management benefits. It consumed 4,483 acres by the end of October at an estimated cost of $150K. No injuries or fatalities were reported nor were any structures lost.",,466,,,,,,,,,,,,,,,,,,,
466,5336815,MARIPOSA CO.,YOSEMITE VLG,10/1/2003,0,Wildfire, , ,0,0,100000,0,CA,PST, ,1162997,C,43,HNX,0,0,PARK/FOREST SERVICE, , , ,2,N,2,N,YOSEMITE VLG, , , , ,"The Duncan Fire was ignited by lightning on July 19th and then allowed to burn for resource management purposes into October. It consumed 1,284 acres by October 3rd at a cost of $100K. No fatalities or injuries were reported.",,467,,,,,,,,,,,,,,,,,,,
467,5336813,TULARE CO.,THREE RIVERS,10/1/2003,0,Wildfire, , ,0,0,1540000,0,CA,PST, ,1162995,C,107,HNX,0,0,PARK/FOREST SERVICE, , , ,7,NE,7,NE,THREE RIVERS, , , , ,"The Paradise 2 Fire was lightning ignited at 2300 PST on September 25th and had previously been reported as part of the Kaweah-Kern Complex in September Stormdata. By the end of October this specific fire had consumed 1,298 acres at a cost of $1.54M.",,468,,,,,,,,,,,,,,,,,,,
468,5336812,TULARE CO.,WILSONIA,10/1/2003,0,Wildfire, , ,0,0,806770,0,CA,PST, ,1162994,C,107,HNX,0,0,PARK/FOREST SERVICE, , , ,14,E,14,E,WILSONIA, , , , ,"The Kaweah-Kern Complex of fires was lightning ignited late in July (includes the Williams, West Kern, Giant, Slide Bluffs, Bubbs, West Clover, High Bridge, East Fork, West Timber, Tar Gap 1 and Gap 2, Fry Pan, Soda Springs, and Homers Nose Fires ... Paradise 2 Fire had formerly been included in this complex but is removed from this report). These fires were generally allowed to burn for resource management purposes.",,469,,,,,,,,,,,,,,,,,,,
469,5336811,MARIPOSA CO.,YOSEMITE VLG,10/1/2003,0,Wildfire, , ,0,0,2900000,0,CA,PST, ,1162993,C,43,HNX,0,0,PARK/FOREST SERVICE, , , ,25,N,25,N,YOSEMITE VLG, , , , ,"The Kibbee Complex Fire was allowed to burn for resource management since its ignition on July 20th. It burned a total of 10,100 acres with a final assessed cost of $2.9M. Its location was described as 18 miles NE of Miwok Village in the northwest corner of Yosemite National Park. No fatalities occurred nor were any structures lost.",,470,,,,,,,,,,,,,,,,,,,
470,5336814,MADERA CO.,MAMMOTH MOUNTAIN,10/1/2003,0,Wildfire, , ,0,0,68000,0,CA,PST, ,1162996,C,39,HNX,0,0,PARK/FOREST SERVICE, , , ,8,SW,8,SW,MAMMOTH MOUNTAIN, , , , ,The Cargyle Complex Fire in the high country of the Southern Sierra Nevada in Madera County was lightning ignited on the 3rd of September. It was allowed to burn past containment of 720 acres on the 3rd of October for resource management purposes. No injuries or fatalities were reported with this fire.,,471,,,,,,,,,,,,,,,,,,,
471,5346289,SAN BERNARDINO CO.,LYTLE CREEK,10/1/2003,1413,Wildfire, , ,0,1,0,0,CA,PST, ,1148420,C,71,SGX,0,0,NEWSPAPER, , , ,2,NW,3,N,LYTLE CREEK, , , , ,,"Named the Lytle Fire, this fire started at the end of the paved road next to an old shooting range. It burned 889 acres before being fully contained. No structures were threatened or lost. One fire fighter sustained a minor injury. Fire fighting costs were $620,000.",472,,,,,,,,,,,,,,,,,,,
472,5335894,SAN BERNARDINO CO.,VICTORVILLE,10/1/2003,1530,Wildfire, , ,0,0,0,0,CA,PST, ,1163272,C,71,SGX,0,0,NEWSPAPER, , , ,3,E,3,E,VICTORVILLE, , , , ,,A wildfire in the Mojave River bed consumed 10 acres of brush before being contained.,473,,,,,,,,,,,,,,,,,,,
473,5337166,SISKIYOU CO.,COUNTYWIDE,10/12/2003,1508,Wildfire, , ,0,0,0,0,CA,PST, ,1163020,C,93,MFR,0,0,OFFICIAL NWS OBS., , , , , , , ,COUNTYWIDE, , , , ,See below.,"A Red Flag Warning was issued at 1508 PDT on 10/12 and expired at 0730 PDT on 10/13 for expected dry and windy conditions in California fire weather zone 280 (western Siskiyou county).  The warning did not verify the night of 10/12-13/04, but the Slater Butte RAWS did meet warning criteria on the night of 10/13-14/03.",474,,,,,,,,,,,,,,,,,,,
474,5335895,SAN DIEGO CO.,DE LUZ,10/21/2003,1201,Wildfire, , ,0,0,0,0,CA,PST, ,1163273,C,73,SGX,0,0,NEWSPAPER, , , ,5,SE,1,S,DE LUZ, , , , ,,"Named the Roblar 2 Fire, this fire was started by live ammunition training on the Camp Pendleton Marine Corps Base, and burned 8,592 acres before it was contained. The community of De Luz was evacuated as the fire jumped the permanent Roblar Fuel Firebreak. Atmospheric conditions during the first few days of the fire were: maximum temperatures near 100 degrees, minimum relative humidity 15 percent, and erratic winds. In addition to very dry and warm conditions, fire fighting efforts were also hampered by the unexploded ordinance laying on the ground. Over 1300 fire fighters were involved and the cost of fighting the fire was estimated at $2 million.",475,,,,,,,,,,,,,,,,,,,
475,5331771,LOS ANGELES CO.,CLAREMONT,10/21/2003,1400,Wildfire, , ,0,0,0,0,CA,PST, ,1163759,C,37,LOX,0,0,FIRE DEPT/RESCUE SQUAD, , , ,6,NE,6,NE,CLAREMONT, , , , ,"The Padua Fire, aided by gusty Santa Ana winds, burned thousands of acres in Los Angeles County. As of the end of the month, the fire had yet to be fully contained. The fire had burned over 8,000 acres by the end of October.",,476,,,,,,,,,,,,,,,,,,,
476,5335896,SAN BERNARDINO CO.,FONTANA,10/21/2003,1422,Wildfire, , ,0,35,50000000,0,CA,PST, ,1163274,C,71,SGX,0,0,NEWSPAPER, , , ,4,NW,5,NW,LYTLE CREEK, , , , ,,"Named the Grand Prix Fire, this fire was started by arsonist on October 21, 2003. It burned 59,448 acres before being fully contained on  November 5, 2003. During the first seven days, the fire increased rapidly in size and burned across freeways, railways, and into the communities of Glen Helen, Cajon Canyon, Mt. Baldy Village, Lytle Creek, Rancho Cucamonga, and Fontana. It destroyed 135 houses, 60 outbuildings, 1 commercial property, 1 helicopter, 11 cars, 1 boat, 1 trailer, and several miles of utility and highway infrastructure. It also damaged another 71 houses and 10 outbuildings. Atmospheric conditions preceding the fire were: maximum temperatures near 105 degrees, minimum relative humidity around 5%, and winds from the northeast 10 to 20 mph during the night and morning hours, switching to southwest 5-10 mph during the afternoon hours. After the fire started, the afternoon southwest winds became more dominate, and the fire generally was wind driven. On October 24, the predominate wind direction returned to northeast and gusted 40 to 70 mph with relative humidities ranging from a minimum of 3% to a maximum of 28%.  On October 25, when the northeast winds temporarily relaxed, the fire became plume dominated as the heat column rose into the dry and unstable mid and upper layers. During this time and for about 30 minutes following the collapse of the plume, fire whirls were observed. On October 26, the west flank of the Old Fire and the east flank of the Grand Prix Fire merged in the Cajon Pass, forming a 30 mile long flaming front. The west flank of the Grand Prix Fire that had now burned into Los Angeles County and the Angeles National Forest, was renamed the Padua Fire for administrative purposes. Smoke from these fires forced the closure of air traffic for four hours at Ontario, Los Angeles, Burbank, and Orange County airports. On the 8th day of the fires, the northeast winds finally relaxed. The following day, October 29, the wind flow switched to the southwest, and the air mass moistened rapidly. Through the remaining days of October and into early November, precipitation fell over the fire area, with rainfall averaging from 0.25 to over 1.00 inch, while 3 to 12 inches of snow fell at elevations above 6500 feet. However, the fire though not as active, was not fully contained when the month of October ended.",477,,,,,,,,,,,,,,,,,,,
477,5335893,RIVERSIDE CO.,HIGH GROVE,10/21/2003,1611,Wildfire, , ,0,0,2500000,0,CA,PST, ,1163271,C,65,SGX,0,0,NEWSPAPER, , , ,2,E,3,NW,MORENO VALLEY, , , , ,,"Named the Pass Fire, this fire was started by an arsonist. It burned 2387 acres and destroyed 5 houses, 1 barn, 21 out buildings, and several vehicles. An additional 3 houses were damaged before the fire was fully controlled. Atmospheric conditions were favorable for rapid fire growth both preceding and during it's life cycle. Maximum temperatures ranged between 95 and 105 degrees. Relative humidities ranged between 5 and 10  percent during the day, and 25 to 30 percent during the night. Wind direction was east to southeast during the night and mornings, shifting to west and northwest during the afternoon hours. Fire fighting costs were estimated at $3 million.",478,,,,,,,,,,,,,,,,,,,
478,5331769,VENTURA CO.,PIRU,10/23/2003,1400,Wildfire, , ,0,0,0,0,CA,PST, ,1163757,C,111,LOX,0,0,FIRE DEPT/RESCUE SQUAD, , , ,6,N,6,N,PIRU, , , , ,"The Piru Fire, aided by gusty Santa Ana winds, burned thousands of acres in Ventura county. As of the end of October, the fire had yet to be fully contained. The fire burned over 60,000 acres of forest in Ventura County by the end of the month and destroyed one residence.",,479,,,,,,,,,,,,,,,,,,,
